{
  "$schema": "http://json-schema.org/schema#",
  "$id": "https://w3c.github.io/webref/schemas/extract-css.json",

  "type": "object",
  "additionalProperties": false,
  "required": ["spec", "properties", "atrules", "valuespaces"],
  "properties": {
    "spec": { "$ref": "common.json#/$defs/specInExtract" },

    "properties": {
      "type": "object",
      "propertyNames": { "$ref": "common.json#/$defs/cssPropertyName" },
      "additionalProperties": {
        "type": "object",
        "additionalProperties": true,
        "properties": {
          "name": { "$ref": "common.json#/$defs/cssPropertyName" },
          "value": { "$ref": "common.json#/$defs/cssValue" },
          "styleDeclaration": {
            "type": "array",
            "items": { "type": "string" },
            "minItems": 1
          }
        }
      }
    },

    "atrules": {
      "type": "object",
      "propertyNames": {
        "type": "string",
        "pattern": "^@"
      },
      "additionalProperties": {
        "type": "object",
        "additionalProperties": false,
        "properties": {
          "value": { "$ref": "common.json#/$defs/cssValue" },
          "descriptors": {
            "type": "array",
            "items": {
              "type": "object",
              "additionalProperties": true,
              "properties": {
                "name": { "type": "string" },
                "for": { "type": "string" },
                "value": { "$ref": "common.json#/$defs/cssValue" }
              }
            }
          }
        }
      }
    },

    "valuespaces": {
      "type": "object",
      "propertyNames": {
        "type": "string",
        "pattern": "^<[^>]+>$"
      },
      "additionalProperties": {
        "type": "object",
        "additionalProperties": false,
        "properties": {
          "prose": { "type": "string" },
          "value": { "$ref": "common.json#/$defs/cssValue" },
          "legacyValue": { "$ref": "common.json#/$defs/cssValue" }
        }
      }
    }
  }
}
