{
  "spec": {
    "title": "CSS Will Change Module Level 1",
    "url": "https://drafts.csswg.org/css-will-change-1/"
  },
  "properties": {
    "will-change": {
      "name": "will-change",
      "value": "auto | <animateable-feature>#",
      "initial": "auto",
      "appliesTo": "all elements",
      "inherited": "no",
      "percentages": "n/a",
      "computedValue": "specified value",
      "canonicalOrder": "per grammar",
      "animationType": "not animatable",
      "styleDeclaration": [
        "will-change",
        "willChange"
      ]
    }
  },
  "atrules": {},
  "valuespaces": {
    "<animateable-feature>": {
      "value": "scroll-position | contents | <custom-ident>"
    }
  }
}
