{
  "spec": {
    "title": "CSS Shared Element Transitions Module Level 1",
    "url": "https://drafts.csswg.org/css-shared-element-transitions-1/"
  },
  "properties": {
    "page-transition-tag": {
      "name": "page-transition-tag",
      "value": "none | <custom-ident>",
      "initial": "none",
      "appliesTo": "all elements",
      "inherited": "no",
      "percentages": "n/a",
      "computedValue": "as specified",
      "canonicalOrder": "per grammar",
      "animationType": "discrete",
      "styleDeclaration": [
        "page-transition-tag",
        "pageTransitionTag"
      ]
    }
  },
  "atrules": {},
  "valuespaces": {
    "<pt-tag-selector>": {
      "value": "'*' | <custom-ident>"
    }
  }
}
