{
  "spec": {
    "title": "Scroll-linked Animations",
    "url": "https://drafts.csswg.org/scroll-animations-1/"
  },
  "properties": {
    "scroll-timeline-name": {
      "name": "scroll-timeline-name",
      "value": "none | <custom-ident>",
      "initial": "none",
      "appliesTo": "scroll containers",
      "inherited": "no",
      "percentages": "n/a",
      "computedValue": "the specified keyword",
      "canonicalOrder": "per grammar",
      "animationType": "not animatable",
      "styleDeclaration": [
        "scroll-timeline-name",
        "scrollTimelineName"
      ]
    },
    "scroll-timeline-axis": {
      "name": "scroll-timeline-axis",
      "value": "block | inline | vertical | horizontal",
      "initial": "block",
      "appliesTo": "scroll containers",
      "inherited": "no",
      "percentages": "n/a",
      "computedValue": "the specified keyword",
      "canonicalOrder": "per grammar",
      "animationType": "not animatable",
      "styleDeclaration": [
        "scroll-timeline-axis",
        "scrollTimelineAxis"
      ]
    },
    "scroll-timeline": {
      "name": "scroll-timeline",
      "value": "<'scroll-timeline-name'> || <'scroll-timeline-axis'>",
      "initial": "see individual properties",
      "appliesTo": "scroll containers",
      "inherited": "no",
      "percentages": "see individual properties",
      "computedValue": "see individual properties",
      "animationType": "not animatable",
      "canonicalOrder": "per grammar",
      "styleDeclaration": [
        "scroll-timeline",
        "scrollTimeline"
      ]
    },
    "view-timeline-name": {
      "name": "view-timeline-name",
      "value": "none | <custom-ident>#",
      "initial": "none",
      "appliesTo": "all elements",
      "inherited": "no",
      "percentages": "n/a",
      "computedValue": "the keyword none or a list of <custom-ident>s",
      "canonicalOrder": "per grammar",
      "animationType": "not animatable",
      "styleDeclaration": [
        "view-timeline-name",
        "viewTimelineName"
      ]
    },
    "view-timeline-axis": {
      "name": "view-timeline-axis",
      "value": "[ block | inline | vertical | horizontal ]#",
      "initial": "block",
      "appliesTo": "all elements",
      "inherited": "no",
      "percentages": "n/a",
      "computedValue": "a list of the keywords specified",
      "canonicalOrder": "per grammar",
      "animationType": "not animatable",
      "styleDeclaration": [
        "view-timeline-axis",
        "viewTimelineAxis"
      ]
    },
    "view-timeline-inset": {
      "name": "view-timeline-inset",
      "value": "[ [ auto | <length-percentage> ]{1,2} ]#",
      "initial": "0",
      "appliesTo": "all elements",
      "inherited": "no",
      "percentages": "relative to the corresponding dimension of the relevant scrollport",
      "computedValue": "a list consisting of two-value pairs representing the start and end insets each as either the keyword auto or a computed <length-percentage> value",
      "canonicalOrder": "per grammar",
      "animationType": "by computed value type",
      "styleDeclaration": [
        "view-timeline-inset",
        "viewTimelineInset"
      ]
    },
    "view-timeline": {
      "name": "view-timeline",
      "value": "[ <'view-timeline-name'> || <'view-timeline-axis'> ]#",
      "initial": "see individual properties",
      "appliesTo": "all elements",
      "inherited": "see individual properties",
      "percentages": "see individual properties",
      "computedValue": "see individual properties",
      "animationType": "see individual properties",
      "canonicalOrder": "per grammar",
      "styleDeclaration": [
        "view-timeline",
        "viewTimeline"
      ]
    },
    "animation-delay": {
      "name": "animation-delay",
      "value": "[ <'animation-delay-start'> <'animation-delay-end'>? | <timeline-range-name> ]#",
      "initial": "see individual properties",
      "appliesTo": "see individual properties",
      "inherited": "see individual properties",
      "percentages": "see individual properties",
      "computedValue": "see individual properties",
      "animationType": "see individual properties",
      "canonicalOrder": "per grammar",
      "styleDeclaration": [
        "animation-delay",
        "animationDelay"
      ]
    },
    "animation-range": {
      "name": "animation-range",
      "value": "[ <'animation-delay-start'> <'animation-delay-end'>? | <timeline-range-name> ]#",
      "initial": "see individual properties",
      "appliesTo": "see individual properties",
      "inherited": "see individual properties",
      "percentages": "see individual properties",
      "computedValue": "see individual properties",
      "animationType": "see individual properties",
      "canonicalOrder": "per grammar",
      "styleDeclaration": [
        "animation-range",
        "animationRange"
      ]
    },
    "animation-delay-start": {
      "name": "animation-delay-start",
      "value": "[ <time> | <timeline-range-name> <percentage> ]",
      "initial": "0s",
      "appliesTo": "all elements",
      "inherited": "no",
      "percentages": "relative to the specified named timeline range",
      "computedValue": "list, each item either a duration or a timeline range and progress percentage",
      "canonicalOrder": "per grammar",
      "animatable": "no",
      "styleDeclaration": [
        "animation-delay-start",
        "animationDelayStart"
      ]
    },
    "animation-delay-end": {
      "name": "animation-delay-end",
      "value": "[ <time> | <timeline-range-name> <percentage> ]",
      "initial": "0s",
      "appliesTo": "all elements",
      "inherited": "no",
      "percentages": "relative to the specified named timeline range",
      "computedValue": "list, each item either a duration or a timeline range and progress percentage",
      "canonicalOrder": "per grammar",
      "animatable": "no",
      "styleDeclaration": [
        "animation-delay-end",
        "animationDelayEnd"
      ]
    }
  },
  "atrules": {},
  "valuespaces": {
    "<timeline-range-name>": {
      "prose": "A named timeline range is a named segment of an animation timeline. The start of the segment is represented as 0% progress through the range; the end of the segment is represented as 100% progress through the range. Multiple named timeline ranges can be attached to a given timeline, and multiple such ranges can overlap. For example, the contain range of a view progress timeline overlaps with its cover range. Named timeline ranges are represented by the <timeline-range-name> value type, which indicates a CSS identifier representing one of the predefined named timeline ranges."
    },
    "<scroll()>": {
      "value": "scroll( <axis>? <scroller>? )"
    },
    "<axis>": {
      "value": "block | inline | vertical | horizontal"
    },
    "<scroller>": {
      "value": "root | nearest"
    },
    "<keyframe-selector>": {
      "value": "from | to | <percentage> | <timeline-range-name> <percentage>"
    }
  }
}
